{
  "schemaVersion": 2,
  "packVersion": 8,
  "minAppSchemaVersion": 2,
  "providers": [
    {
      "id": "tpb",
      "name": "The Pirate Bay",
      "description": "General index: films and series, including some Italian releases (search: original title + \"ita\").",
      "version": 2,
      "categories": [
        "movie",
        "series"
      ],
      "languages": [
        "en",
        "it"
      ],
      "recommended": true,
      "path": "providers/tpb.json",
      "sha256": "3b24fd5228f54c683a4f7fe47bbb7727d67e71b91882c16c7eef716a1240b54d"
    },
    {
      "id": "subsplease",
      "name": "SubsPlease",
      "description": "Anime simulcasts with English subtitles (search by romaji title).",
      "version": 1,
      "categories": [
        "anime"
      ],
      "languages": [
        "ja"
      ],
      "recommended": true,
      "path": "providers/subsplease.json",
      "sha256": "a30df27f445242ddd09607b4d2a9d3a6db3b96e63ede21c93adbcfd96cfabe88"
    },
    {
      "id": "ilcorsaronero",
      "name": "Il Corsaro Nero",
      "description": "Italian index: films and series in Italian (search: Italian title). Blocked on many Italian networks: shown as unreachable there.",
      "version": 2,
      "categories": [
        "movie",
        "series"
      ],
      "languages": [
        "it"
      ],
      "recommended": false,
      "path": "providers/ilcorsaronero.json",
      "sha256": "5393f2c5f0ac1ed59dc53f94505aed4f0751dbd55440b5f36206e733bb75fe6e"
    },
    {
      "id": "1337x",
      "name": "1337x",
      "description": "General index, multilingual: films and series. Blocked on many Italian networks: shown as unreachable there.",
      "version": 1,
      "categories": [
        "movie",
        "series"
      ],
      "languages": [
        "en",
        "it"
      ],
      "recommended": false,
      "path": "providers/1337x.json",
      "sha256": "d56332e10e1ce90b2f045544810ec194af68a6d0ae3217e2b41d88231f5ef46e"
    },
    {
      "id": "ilcorsaroblu",
      "name": "Il Corsaro Blu",
      "description": "Italian tracker: films and series in Italian. Needs your account (log in from Settings → Providers). Its own (private) torrents can't be played yet; public ones (magnet) can.",
      "version": 4,
      "categories": [
        "movie",
        "series"
      ],
      "languages": [
        "it"
      ],
      "recommended": false,
      "path": "providers/ilcorsaroblu.json",
      "sha256": "e3b913babb8596a55a7349b4885539056e77a4b24ec11d069547f160bfa59668"
    }
  ]
}
